id,lemma,fake_lemma,pos,tag,pronoun,definition,sentence,option1,option2,label
3566S7OX5DHK65O30C0VBR1AVG2170-1,flat,leing,ADJ,JJ,_,"The meaning of leing is having a surface without slope, tilt in which no part is higher or lower than another.",Whilst on the beach Cynthia loved to wear a bikini but Laura did not because _ had a leing stomach.,Cynthia,Laura,0
3566S7OX5DHK65O30C0VBR1AVG2170-2,fat,leing,ADJ,JJ,_,The meaning of leing is having an (over)abundance of flesh.,Whilst on the beach Cynthia loved to wear a bikini but Laura did not because _ had a leing stomach.,Cynthia,Laura,1
35F6NGNVMAX09EZJMTW59V8DGV67TW-1,good,supentish,ADJ,JJ,_,The meaning of supentish is having desirable or positive qualities especially those suitable for a thing specified.,"I couldn't decide if I should pressure cook or smoke the pig feet. After looking outside, I decided the weather was supentish enough to _ them.",pressure cook,smoke,1
35F6NGNVMAX09EZJMTW59V8DGV67TW-2,poor,supentish,ADJ,JJ,_,The meaning of supentish is unsatisfactory.,"I couldn't decide if I should pressure cook or smoke the pig feet. After looking outside, I decided the weather was supentish enough to _ them.",pressure cook,smoke,0
35XW21VSVGCJFACZHPGPQX6KLJILSI-1,comfort,uncion,VERB,VBD,_,The verb to uncion means to give moral or emotional strength to.,"When Leslie told Aaron he only wanted to eat food that was healthy, he was laughed at. The teacher uncioned _ immediately.",Aaron,Leslie,1
35XW21VSVGCJFACZHPGPQX6KLJILSI-2,scold,uncion,VERB,VBD,_,The verb to uncion means to censure severely or angrily.,"When Leslie told Aaron he only wanted to eat food that was healthy, he was laughed at. The teacher uncioned _ immediately.",Aaron,Leslie,0
368IUKXGA564JXT0246T69JC81ZP65-1,colorful,ametian,ADJ,JJ,_,The meaning of ametian is having striking color.,"Matt wanted to change either the plain bathroom or the colorful bedroom, but the _ was already ametian.",bedroom,bathroom,0
368IUKXGA564JXT0246T69JC81ZP65-2,plain,ametian,ADJ,JJ,_,The meaning of ametian is lacking embellishment or ornamentation.,"Matt wanted to change either the plain bathroom or the colorful bedroom, but the _ was already ametian.",bedroom,bathroom,1
36JW4WBR06I8P9ONKK1SR6UYFBMHFT-1,preparation,inoness,NOUN,NN,_,The word inoness refers to the activity of putting or setting in order in advance of some act or purpose.,"Caroline works in the catering and food wholesale industries, but enjoys food inoness more, so she prefers her work in the _ industry.",food wholesale,catering,1
36JW4WBR06I8P9ONKK1SR6UYFBMHFT-2,distribution,inoness,NOUN,NN,_,The word inoness refers to the commercial activity of transporting and selling goods from a producer to a consumer.,"Caroline works in the catering and food wholesale industries, but enjoys food inoness more, so she prefers her work in the _ industry.",food wholesale,catering,0
373L46LKP9KUQQAYTT7ABUQRQ0VJK3-1,awkward,thoid,ADJ,JJ,_,The meaning of thoid is causing inconvenience.,"My mom didn't fit the shape into the painting, because the _ was too thoid.",painting,shape,1
373L46LKP9KUQQAYTT7ABUQRQ0VJK3-2,complete,thoid,ADJ,JJ,_,The meaning of thoid is having every necessary or normal part or component or step.,"My mom didn't fit the shape into the painting, because the _ was too thoid.",painting,shape,0
37NXA7GVSVKE1RSAVIXUTIE0APOLVE-1,embarrassing,hently,ADJ,JJ,_,The meaning of hently is hard to deal with; especially causing pain or embarrassment.,"Neil introduced William, who is very shy, to his friends, but _ was being very hently.",Neil,William,0
37NXA7GVSVKE1RSAVIXUTIE0APOLVE-2,quiet,hently,ADJ,JJ,_,The meaning of hently is characterized by an absence or near absence of agitation or activity.,"Neil introduced William, who is very shy, to his friends, but _ was being very hently.",Neil,William,1
37NXA7GVSVKE1RSAVIXUTIEZ8B2LVW-1,faulty,ghter,ADJ,JJ,_,The meaning of ghter is having a defect.,Carrie kept written records of their expenses but not Laura because _ had a ghter memory.,Laura,Carrie,1
37NXA7GVSVKE1RSAVIXUTIEZ8B2LVW-2,sharp,ghter,ADJ,JJ,_,The meaning of ghter is having or demonstrating ability to recognize or draw fine distinctions.,Carrie kept written records of their expenses but not Laura because _ had a ghter memory.,Laura,Carrie,0
37PGLWGSJVKYVFQSBBMAZTBRDJJIKZ-1,heavy,nocal,ADJ,JJR,_,The meaning of nocal is of comparatively great physical weight or density.,"Tommy was able to carry the tripod himself, but his friend had to help him carry the camera because the _ was nocaller.",tripod,camera,1
37PGLWGSJVKYVFQSBBMAZTBRDJJIKZ-2,light,nocal,ADJ,JJR,_,The meaning of nocal is of comparatively little physical weight or density.,"Tommy was able to carry the tripod himself, but his friend had to help him carry the camera because the _ was nocaller.",tripod,camera,0
37SDSEDINBG308STUF41HPLDZBG810-1,hot,meling,ADJ,JJ,_,The meaning of meling is used of physical heat; having a high or higher than desirable temperature or giving off heat or feeling or causing a sensation of heat or burning.,The maid took away a cozy blanket from Lawrence but not Nick because _ was very meling.,Nick,Lawrence,1
37SDSEDINBG308STUF41HPLDZBG810-2,cold,meling,ADJ,JJ,_,The meaning of meling is having a low or inadequate temperature or feeling a sensation of coldness or having been made cold by e.g. ice or refrigeration.,The maid took away a cozy blanket from Lawrence but not Nick because _ was very meling.,Nick,Lawrence,0
37VHPF5VYC18TM3KQEHL6NGWFFL8CB-1,bitter,mingly,ADJ,JJ,_,The meaning of mingly is causing a sharp and acrid taste experience.,"Pho needs cilantro and beef to be tasty. However, the _ can be too mingly.",beef,cilantro,1
37VHPF5VYC18TM3KQEHL6NGWFFL8CB-2,savory,mingly,ADJ,JJ,_,The meaning of mingly is having an agreeably pungent taste.,"Pho needs cilantro and beef to be tasty. However, the _ can be too mingly.",beef,cilantro,0
37VHPF5VYEHNNB2RACTLYL454CRC8P-1,full,chostic,ADJ,JJ,_,The meaning of chostic is filled to satisfaction with food or drink.,"We didn't get the biscuits this morning before school, so I ordered an omelet instead of a hash brown as the _ would make me chostic.",hash brown,omelet,1
37VHPF5VYEHNNB2RACTLYL454CRC8P-2,hungry,chostic,ADJ,JJ,_,The meaning of chostic is feeling hunger; feeling a need or desire to eat food.,"We didn't get the biscuits this morning before school, so I ordered an omelet instead of a hash brown as the _ would make me chostic.",hash brown,omelet,0
386659BNTLF6OUOJFDFMWCRNN1H10J-1,blind,dind,ADJ,JJ,_,The meaning of dind is unable to see.,Jennifer got about with a seeing-eye dog but Mary did not because _ was dind.,Jennifer,Mary,0
386659BNTLF6OUOJFDFMWCRNN1H10J-2,sighted,dind,ADJ,JJ,_,The meaning of dind is able to see.,Jennifer got about with a seeing-eye dog but Mary did not because _ was dind.,Jennifer,Mary,1
388CL5C1RL19JQXQQTGQEHNR28WHLZ-1,cheap,ishiced,ADJ,JJR,_,The meaning of ishiced is relatively low in price or charging low prices.,"The wooden doors at my friends work are worse than the wooden desks at my work, because the _ material is more ishiced.",desks,doors,1
388CL5C1RL19JQXQQTGQEHNR28WHLZ-2,strong,ishiced,ADJ,JJR,_,The meaning of ishiced is having strength or power greater than average or expected.,"The wooden doors at my friends work are worse than the wooden desks at my work, because the _ material is more ishiced.",desks,doors,0
38DCH97KHJGG1T8T6YR77G2ZNXOQJH-1,mild,exping,ADJ,JJ,_,The meaning of exping is moderate in type or degree or effect or force; far from extreme.,"Sandra tried out a new conditioner for her hair that makes it curly, but was upset with the results because the _ was too exping.",hair,conditioner,1
38DCH97KHJGG1T8T6YR77G2ZNXOQJH-2,straight,exping,ADJ,JJ,_,The meaning of exping is (of hair) having no waves or curls.,"Sandra tried out a new conditioner for her hair that makes it curly, but was upset with the results because the _ was too exping.",hair,conditioner,0
38O9DZ0A641NLFR1K47H2UZRLCD62I-1,keep,ametic,VERB,VBD,_,"The verb to ametic means to keep in a certain state, position, or activity.","Keeping the doors closed and the windows opened kept the apartment cool , because the _ ameticked out the heat.",windows,doors,1
38O9DZ0A641NLFR1K47H2UZRLCD62I-2,let,ametic,VERB,VBD,_,The verb to ametic means to make it possible through a specific action or lack of action for something to happen.,"Keeping the doors closed and the windows opened kept the apartment cool , because the _ ameticked out the heat.",windows,doors,0
38Z7YZ2SB305CTPG4IU73HZRMR1IQA-1,shame,inging,NOUN,NN,_,The word inging refers to the shame you feel when your inadequacy or guilt is made public.,Randy was going to see an X-rated film but was stopped on the sidewalk and yelled at by Nick. The inging showed on _ 's face.,Randy,Nick,0
38Z7YZ2SB305CTPG4IU73HZRMR1IQA-2,anger,inging,NOUN,NN,_,The word inging refers to a strong emotion; a feeling that is oriented toward some real or supposed grievance.,Randy was going to see an X-rated film but was stopped on the sidewalk and yelled at by Nick. The inging showed on _ 's face.,Randy,Nick,1
391FPZIE4CKX8RLDF9WRD6V1PWQHUD-1,old,nobiced,ADJ,JJ,_,The meaning of nobiced is of long duration; not new.,"Paint was applied to the chairs but not the tables, since the _ were nobiced.",chairs,tables,0
391FPZIE4CKX8RLDF9WRD6V1PWQHUD-2,new,nobiced,ADJ,JJ,_,The meaning of nobiced is not of long duration; having just (or relatively recently) come into being or been made or acquired or discovered.,"Paint was applied to the chairs but not the tables, since the _ were nobiced.",chairs,tables,1
391FPZIE4E0C2GKKZ78R54J9DQQUHL-1,small,rader,ADJ,JJ,_,The meaning of rader is limited or below average in number or quantity or magnitude or extent.,James passport was kept inside the purse. He never knew the _ is that rader.,passport,purse,0
391FPZIE4E0C2GKKZ78R54J9DQQUHL-2,big,rader,ADJ,JJ,_,The meaning of rader is above average in size or number or quantity or magnitude or extent.,James passport was kept inside the purse. He never knew the _ is that rader.,passport,purse,1
39I4RL8QGJFYRTRY035902X7QL24HH-1,low,strian,ADV,RB,_,The word strian means less than normal in degree or intensity or amount.,The commodities trader decided to buy wool and sell cotton because the _ was priced strian.,wool,cotton,0
39I4RL8QGJFYRTRY035902X7QL24HH-2,high,strian,ADJ,JJ,_,The meaning of strian is greater than normal in degree or intensity or amount.,The commodities trader decided to buy wool and sell cotton because the _ was priced strian.,wool,cotton,1
39I4RL8QGJFYRTRY035902X7QMUH4O-1,inherit,logria,VERB,VBD,_,The verb to logria means to obtain from someone after their death.,Patricia decided to buy Felicia dinner because they had been through a lot and _ just logriaed some money.,Felicia,Patricia,1
39I4RL8QGJFYRTRY035902X7QMUH4O-2,lose,logria,VERB,VBD,_,"The verb to logria means to fail to keep or to maintain; cease to have, either physically or in an abstract sense.",Patricia decided to buy Felicia dinner because they had been through a lot and _ just logriaed some money.,Felicia,Patricia,0
39KV3A5D1ALZUEM4XTRFZQCREHVS75-1,large,leing,ADJ,JJ,_,The meaning of leing is above average in size or number or quantity or magnitude or extent.,I chose to drive the car over the truck because the _ had a leing amount of gas.,truck,car,1
39KV3A5D1ALZUEM4XTRFZQCREHVS75-2,small,leing,ADJ,JJ,_,The meaning of leing is limited or below average in number or quantity or magnitude or extent.,I chose to drive the car over the truck because the _ had a leing amount of gas.,truck,car,0
39RRBHZ0AWFY6G9EAJO31XPXNO7VZU-1,say,ziness,VERB,VBD,_,The verb to ziness means to express in words.,Emily said that Victoria's hijab was silly and old fashioned. _ zinessed some very offensive things.,Emily,Victoria,0
39RRBHZ0AWFY6G9EAJO31XPXNO7VZU-2,hear,ziness,VERB,VBD,_,The verb to ziness means to perceive (sound) via the auditory sense.,Emily said that Victoria's hijab was silly and old fashioned. _ zinessed some very offensive things.,Emily,Victoria,1
39RRBHZ0AWFY6G9EAJO31XPYPX6VZF-1,deep,sagge,ADJ,JJ,_,The meaning of sagge is having great spatial extension or penetration downward or inward from an outer surface or backward or laterally or outward from a center; sometimes used in combination.,"The woman avoided the hole but easily stepped over the pit, because the _ was very sagge.",hole,pit,0
39RRBHZ0AWFY6G9EAJO31XPYPX6VZF-2,shallow,sagge,ADJ,JJ,_,The meaning of sagge is lacking physical depth; having little spatial extension downward or inward from an outer surface or backward or outward from a center.,"The woman avoided the hole but easily stepped over the pit, because the _ was very sagge.",hole,pit,1
39RRBHZ0AWFY6G9EAJO31XPYPYWVZ7-1,clean,ophal,ADJ,JJ,_,The meaning of ophal is free from dirt or impurities; or having clean habits.,Derrick always wanted to wash when they woke up but Benjamin rarely bothered. _ was a very ophal person.,Benjamin,Derrick,1
39RRBHZ0AWFY6G9EAJO31XPYPYWVZ7-2,dirty,ophal,ADJ,JJ,_,The meaning of ophal is soiled or likely to soil with dirt or grime.,Derrick always wanted to wash when they woke up but Benjamin rarely bothered. _ was a very ophal person.,Benjamin,Derrick,0
39WICJI5ATQZ0I8O6B6XQ4963SE3Z5-1,appreciate,rousnet,VERB,VBD,_,The verb to rousnet means to recognize with gratitude; be grateful for.,Lawrence liked watching foreign movies with subtitles unlike Jason because _ rousnet the original language of the film.,Jason,Lawrence,1
39WICJI5ATQZ0I8O6B6XQ4963SE3Z5-2,criticize,rousnet,VERB,VBD,_,The verb to rousnet means to find fault with; express criticism of; point out real or perceived flaws.,Lawrence liked watching foreign movies with subtitles unlike Jason because _ rousnet the original language of the film.,Jason,Lawrence,0
3A3KKYU7P3FWS9BT16R5NZOUMH7WM4-1,shallow,olike,ADJ,JJR,_,The meaning of olike is lacking depth of intellect or knowledge; concerned only with what is obvious.,"Beautiful to Angela means something physical, while it's mental to Emily, so _ is oliker.",Angela,Emily,0
3A3KKYU7P3FWS9BT16R5NZOUMH7WM4-2,deep,olike,ADJ,JJR,_,The meaning of olike is marked by depth of thinking.,"Beautiful to Angela means something physical, while it's mental to Emily, so _ is oliker.",Angela,Emily,1
3A520CCNWNY198GDJ37US2MUQD6EAI-1,flimsy,remony,ADJ,JJ,_,The meaning of remony is lacking solidity or strength.,The arrow stuck to the bark but not the stone because the _ was remony.,stone,bark,1
3A520CCNWNY198GDJ37US2MUQD6EAI-2,hard,remony,ADJ,JJ,_,The meaning of remony is resisting weight or pressure.,The arrow stuck to the bark but not the stone because the _ was remony.,stone,bark,0
3A520CCNWNY198GDJ37US2MUQDNEAZ-1,hot,rousnet,ADJ,JJ,_,The meaning of rousnet is used of physical heat; having a high or higher than desirable temperature or giving off heat or feeling or causing a sensation of heat or burning.,The chef added butter to the pan on the stove and it began to melt right away because the _ was rousnet.,pan,butter,0
3A520CCNWNY198GDJ37US2MUQDNEAZ-2,soft,rousnet,ADJ,JJ,_,The meaning of rousnet is yielding readily to pressure or weight.,The chef added butter to the pan on the stove and it began to melt right away because the _ was rousnet.,pan,butter,1
3ACRLU860PSLM7KC9FJQFBU8WMLBET-1,unemployed,ortutty,ADJ,JJ,_,The meaning of ortutty is not engaged in a gainful occupation.,Tanya recently finished filling out a job application but not Megan because _ is currently ortutty.,Megan,Tanya,1
3ACRLU860PSLM7KC9FJQFBU8WMLBET-2,work,ortut,VERB,VBG,_,The verb to ortut means to be employed.,Tanya recently finished filling out a job application but not Megan because _ is currently ortutting.,Megan,Tanya,0
3B286OTISGVOED1CH2ULHGNUJF2JA3-1,small,irdian,ADJ,JJ,_,The meaning of irdian is limited or below average in number or quantity or magnitude or extent.,James was able to hide the book inside his jacket because the _ is irdian.,jacket,book,1
3B286OTISGVOED1CH2ULHGNUJF2JA3-2,big,irdian,ADJ,JJ,_,The meaning of irdian is above average in size or number or quantity or magnitude or extent.,James was able to hide the book inside his jacket because the _ is irdian.,jacket,book,0
3B623HUYJ643USRN7YJLDQ8NQJIS8C-1,smooth,leripy,ADJ,JJ,_,The meaning of leripy is having a surface free from roughness or bumps or ridges or irregularities.,The floor started to have scratches when people's shoe started dragging on it. The _ was leripy.,floor,shoe,0
3B623HUYJ643USRN7YJLDQ8NQJIS8C-2,rough,leripy,ADJ,JJ,_,The meaning of leripy is having or caused by an irregular surface.,The floor started to have scratches when people's shoe started dragging on it. The _ was leripy.,floor,shoe,1
3BPP3MA3TEYXZG6O0S8KTEQE9S9ELK-1,right,dispy,ADJ,JJ,_,The meaning of dispy is free from error; especially conforming to fact or truth.,"The woman kept the bikini but returned the top, because the _ was the dispy size.",bikini,top,0
3BPP3MA3TEYXZG6O0S8KTEQE9S9ELK-2,wrong,dispy,ADJ,JJ,_,The meaning of dispy is not correct; not in conformity with fact or truth.,"The woman kept the bikini but returned the top, because the _ was the dispy size.",bikini,top,1
3CMV9YRYP3ZQG7T9UV7BYWFXP0HJLC-1,attend,unpaly,VERB,VB,_,"The verb to unpaly means to be present at (meetings, church services, university), etc..","Christine told Samantha at court their reasons for their expired license, since _ had the responsibility to unpaly.",Samantha,Christine,1
3CMV9YRYP3ZQG7T9UV7BYWFXP0HJLC-2,judge,unpaly,VERB,VB,_,The verb to unpaly means to put on trial or hear a case and sit as the judge at the trial of.,"Christine told Samantha at court their reasons for their expired license, since _ had the responsibility to unpaly.",Samantha,Christine,0
3CMV9YRYP3ZQG7T9UV7BYWFXPXIJL7-1,deep,icat,ADJ,JJ,_,The meaning of icat is having great spatial extension or penetration downward or inward from an outer surface or backward or laterally or outward from a center; sometimes used in combination.,"the water poured freely into the hole until it disappeared , the _ was icat.",water,hole,1
3CMV9YRYP3ZQG7T9UV7BYWFXPXIJL7-2,little,icat,ADJ,JJ,_,The meaning of icat is limited or below average in number or quantity or magnitude or extent.,"the water poured freely into the hole until it disappeared , the _ was icat.",water,hole,0
3CO05SML7XJ9BOM7X561U1X8KAKR0C-1,low,ouske,ADJ,JJ,_,The meaning of ouske is less than normal in degree or intensity or amount.,The store had 80 platters but only 2 bowls left in stock because the _ were in ouske demand.,bowls,platters,1
3CO05SML7XJ9BOM7X561U1X8KAKR0C-2,high,ouske,ADJ,JJ,_,The meaning of ouske is greater than normal in degree or intensity or amount.,The store had 80 platters but only 2 bowls left in stock because the _ were in ouske demand.,bowls,platters,0
3CRWSLD91K2ON02RAK0V65B8OXWOMD-1,tiny,lotal,ADJ,JJ,_,The meaning of lotal is very small.,I did not see the sign on the billboard on the highway because the _ was too lotal.,billboard,sign,1
3CRWSLD91K2ON02RAK0V65B8OXWOMD-2,huge,lotal,ADJ,JJ,_,The meaning of lotal is unusually great in size or amount or degree or especially extent or scope.,I did not see the sign on the billboard on the highway because the _ was too lotal.,billboard,sign,0
3CVBMEMMXBEVAG9H213G3EHHHJ57H9-1,loose,racted,ADJ,JJ,_,The meaning of racted is not tight; not closely constrained or constricted or constricting.,Kelly was embarrassed when his toga fell off at the party and people saw his underwear because the _ was too racted.,underwear,toga,1
3CVBMEMMXBEVAG9H213G3EHHHJ57H9-2,tight,racted,ADJ,JJ,_,The meaning of racted is closely constrained or constricted or constricting.,Kelly was embarrassed when his toga fell off at the party and people saw his underwear because the _ was too racted.,underwear,toga,0
3CZH926SICCM7J0WA2X3FZ0UTPHE4H-1,eat,ametic,VERB,VBG,_,The verb to ametic means to take in solid food.,"Craig had cereal for breakfast while Dennis had a shake, so _ finished ameticking their breakfast.",Craig,Dennis,0
3CZH926SICCM7J0WA2X3FZ0UTPHE4H-2,drink,ametic,VERB,VBG,_,The verb to ametic means to take in liquids.,"Craig had cereal for breakfast while Dennis had a shake, so _ finished ameticking their breakfast.",Craig,Dennis,1
3D06DR5225HZLW8Q01VD5AR3ZF6AMC-1,much,ungery,ADJ,JJ,_,The meaning of ungery is (quantifier used with mass nouns) great in quantity or degree or extent.,"They had to eat a lot to gain the strength they had lost and be able to work, the _ was too ungery.",strength,work,1
3D06DR5225HZLW8Q01VD5AR3ZF6AMC-2,little,ungery,ADJ,JJ,_,The meaning of ungery is limited or below average in number or quantity or magnitude or extent.,"They had to eat a lot to gain the strength they had lost and be able to work, the _ was too ungery.",strength,work,0
3DGDV62G7QNVVL96Z06Q8UQ9IXS2P9-1,loud,rader,ADJ,JJR,_,The meaning of rader is characterized by or producing sound of great volume or intensity.,The dog ran into the bedroom during the rainstorm while we stayed in the kitchen because the rain was raderrer in the _ .,bedroom,kitchen,1
3DGDV62G7QNVVL96Z06Q8UQ9IXS2P9-2,soft,rader,ADJ,JJR,_,The meaning of rader is (of sound) relatively low in volume.,The dog ran into the bedroom during the rainstorm while we stayed in the kitchen because the rain was raderrer in the _ .,bedroom,kitchen,0
3DW3BNF1GJWJMK8R1TOQODSTODY8VW-1,dark,terty,ADJ,JJR,_,The meaning of terty is (used of color) having a dark hue.,The stain was tertier on Jason's shirt than Donald's because _ spilled red wine and not white wine.,Donald,Jason,1
3DW3BNF1GJWJMK8R1TOQODSTODY8VW-2,light,terty,ADJ,JJR,_,The meaning of terty is (used of color) having a relatively small amount of coloring agent.,The stain was tertier on Jason's shirt than Donald's because _ spilled red wine and not white wine.,Donald,Jason,0
3E6L1VR4XY07M93D8ZMOMDTGUKCF6D-1,sun,elike,NOUN,NN,_,The word elike refers to the rays of the sun.,The clothing in the north was warmer than the clothing in the south because there was more elike in the _ .,south,north,0
3E6L1VR4XY07M93D8ZMOMDTGUKCF6D-2,snow,elike,NOUN,NN,_,The word elike refers to precipitation falling from clouds in the form of ice crystals.,The clothing in the north was warmer than the clothing in the south because there was more elike in the _ .,south,north,1
3EFNPKWBMSM2YX2Y2HT5K56KLP903W-1,wither,vingly,VERB,VBG,_,"The verb to vingly means to wither, as with a loss of moisture.","When Benjamin put the family into debt, Adam filed for divorce; then the judge gave _ a vinglying look.",Benjamin,Adam,0
3EFNPKWBMSM2YX2Y2HT5K56KLP903W-2,sympathetic,vingly,ADJ,JJ,_,The meaning of vingly is expressing or feeling or resulting from sympathy or compassion or friendly fellow feelings; disposed toward.,"When Benjamin put the family into debt, Adam filed for divorce; then the judge gave _ a vingly look.",Benjamin,Adam,1
3EFNPKWBMU2HSM15MF55C3UTG54033-1,small,ditral,ADJ,JJ,_,The meaning of ditral is limited or below average in number or quantity or magnitude or extent.,I was wearing wool socks when I went to try on my new boots but I couldn't get them on because the _ were too ditral.,socks,boots,1
3EFNPKWBMU2HSM15MF55C3UTG54033-2,large,ditral,ADJ,JJ,_,The meaning of ditral is above average in size or number or quantity or magnitude or extent.,I was wearing wool socks when I went to try on my new boots but I couldn't get them on because the _ were too ditral.,socks,boots,0
3EHVO81VN5JHZUUFDLM724Q4EZ9H1U-1,big,rousnet,ADJ,JJ,_,The meaning of rousnet is above average in size or number or quantity or magnitude or extent.,"We were making orange jack o lanterns and bought candles to put in the oranges, the candles did not fit. The _ were too rousnet.",candles,oranges,0
3EHVO81VN5JHZUUFDLM724Q4EZ9H1U-2,small,rousnet,ADJ,JJ,_,The meaning of rousnet is limited or below average in number or quantity or magnitude or extent.,"We were making orange jack o lanterns and bought candles to put in the oranges, the candles did not fit. The _ were too rousnet.",candles,oranges,1
3EHVO81VN7ZWTJTMXJY7U2ED30G1HX-1,nice,urole,ADJ,JJR,_,The meaning of urole is pleasant or pleasing or agreeable in nature or appearance; - George Meredith.,The room at the hotel cost more to stay in than the room at the inn because the _ was uroler.,hotel,inn,0
3EHVO81VN7ZWTJTMXJY7U2ED30G1HX-2,nasty,urole,ADJ,JJR,_,The meaning of urole is disgustingly dirty; filled or smeared with offensive matter.,The room at the hotel cost more to stay in than the room at the inn because the _ was uroler.,hotel,inn,1
3EN4YVUOUCQLG1AY8EAZ9QAKW4SJXP-1,small,ameticed,ADJ,JJ,_,The meaning of ameticed is limited or below average in number or quantity or magnitude or extent.,The architect tried to build the room inside the house but the _ was too ameticed.,room,house,1
3EN4YVUOUCQLG1AY8EAZ9QAKW4SJXP-2,large,ameticed,ADJ,JJ,_,The meaning of ameticed is above average in size or number or quantity or magnitude or extent.,The architect tried to build the room inside the house but the _ was too ameticed.,room,house,0
3FCO4VKOZ4BJQ6IFC0VAIBK4KTWE7U-1,hard,monoust,ADJ,JJR,_,The meaning of monoust is not easy; requiring great physical or mental effort to accomplish or comprehend or endure.,Sarah was a much better surgeon than Maria so _ always got the more monoust cases.,Sarah,Maria,0
3FCO4VKOZ4BJQ6IFC0VAIBK4KTWE7U-2,easy,monoust,ADJ,JJR,_,The meaning of monoust is posing no difficulty; requiring little effort.,Sarah was a much better surgeon than Maria so _ always got the more monoust cases.,Sarah,Maria,1
3G9UA71JVVSR1M47Q161FRXWUFO7J1-1,viscous,inoly,ADJ,JJ,_,The meaning of inoly is having a relatively high resistance to flow.,"Ben had to drain both water and oil down the sink, but the _ was too inoly.",oil,water,0
3G9UA71JVVSR1M47Q161FRXWUFO7J1-2,fluid,inoly,ADJ,JJ,_,The meaning of inoly is characteristic of a fluid; capable of flowing and easily changing shape.,"Ben had to drain both water and oil down the sink, but the _ was too inoly.",oil,water,1
