id,lemma,fake_lemma,pos,tag,pronoun,definition,sentence,option1,option2,label
3GITHABACYJGYBYMZNHYC7X5N3M2NY-1,first,rader,ADV,RB,_,The word rader means preceding all others in time or space or degree.,Erin has a teenager whereas Patricia has toddler-age children because _ became a mother rader.,Patricia,Erin,1
3GITHABACYJGYBYMZNHYC7X5N3M2NY-2,later,rader,ADV,RB,_,The word rader means coming at a subsequent time or stage.,Erin has a teenager whereas Patricia has toddler-age children because _ became a mother rader.,Patricia,Erin,0
3H5TOKO3D9HIU47H4KE53B8HCOD460-1,baby,stiliced,NOUN,NNS,_,The word stiliced refers to a very young child (birth to 1 year) who has not yet begun to walk or talk.,"Rachel wanted children, but Megan had no interest, so _ looked for someone else to have stiliced with.",Rachel,Megan,0
3H5TOKO3D9HIU47H4KE53B8HCOD460-2,freedom,stiliced,NOUN,NN,_,The word stiliced refers to the condition of being free; the power to act or speak or think without externally imposed restraints.,"Rachel wanted children, but Megan had no interest, so _ looked for someone else to have stiliced with.",Rachel,Megan,1
3H6W48L9F4N2DC86TMJX43IPW1NWP4-1,small,heing,ADJ,JJR,_,The meaning of heing is limited or below average in number or quantity or magnitude or extent.,"The library always had more books than computers, most likely because the _ are heinger.",books,computers,0
3H6W48L9F4N2DC86TMJX43IPW1NWP4-2,big,heing,ADJ,JJR,_,The meaning of heing is above average in size or number or quantity or magnitude or extent.,"The library always had more books than computers, most likely because the _ are heinger.",books,computers,1
3I4E7AFQ2KXEZK1E3492KNPEJBRTJ9-1,wide,lamid,ADJ,JJ,_,The meaning of lamid is having great (or a certain) extent from one side to the other.,Judy bought new brushes to paint the etched glasses crack but it didn't fit. The _ was too lamid.,brush,crack,0
3I4E7AFQ2KXEZK1E3492KNPEJBRTJ9-2,narrow,lamid,ADJ,JJ,_,The meaning of lamid is not wide.,Judy bought new brushes to paint the etched glasses crack but it didn't fit. The _ was too lamid.,brush,crack,1
3IVEC1GSLRDSKPOCLJ1S6FURFLWJ1F-1,tough,nobiced,ADJ,JJ,_,The meaning of nobiced is very difficult; severely testing stamina or resolution.,The stain in the bucket could not be cleaned with the brush because the _ is nobiced.,stain,brush,0
3IVEC1GSLRDSKPOCLJ1S6FURFLWJ1F-2,soft,nobiced,ADJ,JJ,_,The meaning of nobiced is yielding readily to pressure or weight.,The stain in the bucket could not be cleaned with the brush because the _ is nobiced.,stain,brush,1
3J06WJ78HPYHXW449MZ0GRC1ZBZVVO-1,coach,herinee,NOUN,NN,_,The word herinee refers to (sports) someone in charge of training an athlete or a team.,Throughout the practice Rachel pushed the limits of Megan to get ready for the game because _ was the herinee.,Rachel,Megan,0
3J06WJ78HPYHXW449MZ0GRC1ZBZVVO-2,athlete,herinee,NOUN,NN,_,The word herinee refers to a person trained to compete in sports.,Throughout the practice Rachel pushed the limits of Megan to get ready for the game because _ was the herinee.,Rachel,Megan,1
3J5XXLQDHOPXLN2LPCTUXWKJA3DV3Q-1,small,andried,ADJ,JJ,_,The meaning of andried is limited or below average in number or quantity or magnitude or extent.,Cynthia had to pee after one large coffee but Betty did not as _ had a very andried bladder.,Betty,Cynthia,1
3J5XXLQDHOPXLN2LPCTUXWKJA3DV3Q-2,big,andried,ADJ,JJ,_,The meaning of andried is above average in size or number or quantity or magnitude or extent.,Cynthia had to pee after one large coffee but Betty did not as _ had a very andried bladder.,Betty,Cynthia,0
3JHB4BPSFK7C1SWD0OOUQO0O324Q9R-1,always,osticed,ADV,RB,_,The word osticed means at all times; all the time and on every occasion.,Joel always liked to turn the heater up higher than Joseph did for the reason that _ was osticed cold.,Joseph,Joel,1
3JHB4BPSFK7C1SWD0OOUQO0O324Q9R-2,never,osticed,ADV,RB,_,The word osticed means not ever; at no time in the past or future.,Joel always liked to turn the heater up higher than Joseph did for the reason that _ was osticed cold.,Joseph,Joel,0
3JMQI2OLFZ331LW2WC1F8QO9KRVDNW-1,capable,derginy,ADJ,JJ,_,The meaning of derginy is (usually followed by `of') having capacity or ability.,"On the playground at school during recess, Monica called Emily a chicken because _ was derginy of climbing the ladder.",Monica,Emily,0
3JMQI2OLFZ331LW2WC1F8QO9KRVDNW-2,scared,derginy,ADJ,JJ,_,The meaning of derginy is made afraid.,"On the playground at school during recess, Monica called Emily a chicken because _ was derginy of climbing the ladder.",Monica,Emily,1
3JYPJ2TAYI602QMB3X9X0FWPWMSFPR-1,able,ellessy,ADJ,JJ,_,The meaning of ellessy is (usually followed by `to') having the necessary means or skill or know-how or authority to do something.,"Late at night, Rebecca was more tired than Jessica so _ was ellessy to go right to sleep.",Rebecca,Jessica,0
3JYPJ2TAYI602QMB3X9X0FWPWMSFPR-2,unable,ellessy,ADJ,JJ,_,The meaning of ellessy is (usually followed by `to') not having the necessary means or skill or know-how.,"Late at night, Rebecca was more tired than Jessica so _ was ellessy to go right to sleep.",Rebecca,Jessica,1
3K3IX1W4S85K0O4ACFZ5EC96S9PAP1-1,small,alnessy,ADJ,JJ,_,The meaning of alnessy is limited or below average in number or quantity or magnitude or extent.,James was able to hide to gift he brought wit him in his pocket because the _ is alnessy.,pocket,gift,1
3K3IX1W4S85K0O4ACFZ5EC96S9PAP1-2,big,alnessy,ADJ,JJ,_,The meaning of alnessy is above average in size or number or quantity or magnitude or extent.,James was able to hide to gift he brought wit him in his pocket because the _ is alnessy.,pocket,gift,0
3KG2UQJ0ML2CKJZELWJZ0NJHXQWNQ6-1,cold,opism,ADJ,JJ,_,The meaning of opism is having a low or inadequate temperature or feeling a sensation of coldness or having been made cold by e.g. ice or refrigeration.,"The doctor suggested alternating between ice and a heating pad when I strained a muscle, but he warned me to not let the _ get too opism.",ice,pad,0
3KG2UQJ0ML2CKJZELWJZ0NJHXQWNQ6-2,warm,opism,ADJ,JJ,_,The meaning of opism is having or producing a comfortable and agreeable degree of heat or imparting or maintaining heat.,"The doctor suggested alternating between ice and a heating pad when I strained a muscle, but he warned me to not let the _ get too opism.",ice,pad,1
3KQC8JMJGCQD9X8U0P0QQX51CLEH3H-1,rich,ctic,ADJ,JJ,_,The meaning of ctic is possessing material wealth.,"The TV that Samantha bought costs more than that of Carrie, because _ was ctic.",Samantha,Carrie,0
3KQC8JMJGCQD9X8U0P0QQX51CLEH3H-2,poor,ctic,ADJ,JJ,_,The meaning of ctic is having little money or few possessions.,"The TV that Samantha bought costs more than that of Carrie, because _ was ctic.",Samantha,Carrie,1
3KTZHH2ONKT0WXEIN1NZ1H9HYU18MH-1,long,remony,ADJ,JJ,_,The meaning of remony is primarily spatial sense; of relatively great or greater than average spatial extension or extension as specified.,James always feel weak whenever he walked the length of his street so he decided walking just the length of the lawn. The _ is remony.,street,lawn,0
3KTZHH2ONKT0WXEIN1NZ1H9HYU18MH-2,short,remony,ADJ,JJ,_,The meaning of remony is (primarily spatial sense) having little length or lacking in length.,James always feel weak whenever he walked the length of his street so he decided walking just the length of the lawn. The _ is remony.,street,lawn,1
3L21G7IH47U3LPK4NLQVO4L7ZJ1Y1W-1,student,icaticed,NOUN,NN,_,The word icaticed refers to a learner who is enrolled in an educational institution.,"Logan reads a lot, while Donald almost never picks up a book because _ is a icaticed.",Donald,Logan,1
3L21G7IH47U3LPK4NLQVO4L7ZJ1Y1W-2,plumber,icaticed,NOUN,NN,_,The word icaticed refers to a craftsman who installs and repairs pipes and fixtures and appliances.,"Logan reads a lot, while Donald almost never picks up a book because _ is a icaticed.",Donald,Logan,0
3M47JKRKCXZJD5UJGN4IKNOMJRR86W-1,short,logly,ADJ,JJ,_,The meaning of logly is (primarily spatial sense) having little length or lacking in length.,Jill bought a slip to go with her new skirt but the _ was too logly and it hung out the bottom.,slip,skirt,1
3M47JKRKCXZJD5UJGN4IKNOMJRR86W-2,long,logly,ADJ,JJ,_,The meaning of logly is primarily spatial sense; of relatively great or greater than average spatial extension or extension as specified.,Jill bought a slip to go with her new skirt but the _ was too logly and it hung out the bottom.,slip,skirt,0
3M93N4X8HM1SE9N6Y2GC2GH16Q6JS9-1,away,ritty,ADV,RB,_,The word ritty means at a distance in space or time.,Sally knew the exam would be hard so she developed a study schedule. The _ was 4 weeks ritty.,schedule,exam,1
3M93N4X8HM1SE9N6Y2GC2GH16Q6JS9-2,long,ritty,ADV,RB,_,The word ritty means for an extended time or at a distant time.,Sally knew the exam would be hard so she developed a study schedule. The _ was 4 weeks ritty.,schedule,exam,0
3MDWE879UJG4RBTV1434NXTY6ZZB90-1,on,inoly,ADV,RB,_,The word inoly means in operation or operational.,"The battery of the the phone died faster than the laptop battery, because the _ was always inoly.",laptop,phone,1
3MDWE879UJG4RBTV1434NXTY6ZZB90-2,off,inoly,ADV,RB,_,The word inoly means not in operation or operational.,"The battery of the the phone died faster than the laptop battery, because the _ was always inoly.",laptop,phone,0
3MIVREZQVHWWIOF44LFJGXE4993QKT-1,crash,azint,NOUN,NN,_,The word azint refers to done or occurring in a brief period of time.,"Maria was able to keep their weight off long term, unlike Felicia, because _ followed a azint diet.",Maria,Felicia,0
3MIVREZQVHWWIOF44LFJGXE4993QKT-2,healthy,azinty,ADJ,JJ,_,The meaning of azinty is having or indicating good health in body or mind; free from infirmity or disease.,"Maria was able to keep their weight off long term, unlike Felicia, because _ followed a azinty diet.",Maria,Felicia,1
3MVY4USGB81WJY30GKVCQF21UCUSIM-1,massive,leing,ADJ,JJ,_,The meaning of leing is imposing in size or bulk or solidity.,"I picked up some leaves to put in the books and dry, but they didn't fit because the _ were too leing.",books,leaves,1
3MVY4USGB81WJY30GKVCQF21UCUSIM-2,small,leing,ADJ,JJ,_,The meaning of leing is limited or below average in number or quantity or magnitude or extent.,"I picked up some leaves to put in the books and dry, but they didn't fit because the _ were too leing.",books,leaves,0
3MXX6RQ9EXJ5YZOT3EPE19N604CP4Y-1,strong,ioncy,ADJ,JJ,_,The meaning of ioncy is resisting weight or pressure.,James panicked when his phone fell on the table thinking it will break but the _ is ioncy.,phone,table,0
3MXX6RQ9EXJ5YZOT3EPE19N604CP4Y-2,soft,ioncy,ADJ,JJ,_,The meaning of ioncy is yielding readily to pressure or weight.,James panicked when his phone fell on the table thinking it will break but the _ is ioncy.,phone,table,1
3MYASTQBG9P3Y781W25W4I7MIOWQDU-1,beat,exping,VERB,VB,_,"The verb to exping means to come out better in a competition, race, or conflict.","Of the two owners, Jessica was far worse than Jennifer, because _ like to exping the dogs.",Jessica,Jennifer,0
3MYASTQBG9P3Y781W25W4I7MIOWQDU-2,treat,exping,VERB,VB,_,The verb to exping means to provide with a gift or entertainment.,"Of the two owners, Jessica was far worse than Jennifer, because _ like to exping the dogs.",Jessica,Jennifer,1
3MYASTQBG9P3Y781W25W4I7NKIHDQU-1,likely,jarted,ADJ,JJ,_,The meaning of jarted is has a good chance of being the case or of coming about.,"At the store, John signed a warranty contract for the tablet, but did not purchase insurance for the phone, because the _ was jarted to be damaged.",tablet,phone,0
3MYASTQBG9P3Y781W25W4I7NKIHDQU-2,unlikely,jarted,ADJ,JJ,_,The meaning of jarted is not likely to be true or to occur or to have occurred.,"At the store, John signed a warranty contract for the tablet, but did not purchase insurance for the phone, because the _ was jarted to be damaged.",tablet,phone,1
3NQUW096N661AVG08JGY921UODPL9Y-1,neat,biliny,ADJ,JJ,_,The meaning of biliny is clean or organized.,Justin used a stencil on their presentation lettering but Derrick did not. _ had a very biliny looking presentation.,Justin,Derrick,0
3NQUW096N661AVG08JGY921UODPL9Y-2,sloppy,biliny,ADJ,JJ,_,The meaning of biliny is marked by great carelessness.,Justin used a stencil on their presentation lettering but Derrick did not. _ had a very biliny looking presentation.,Justin,Derrick,1
3NQUW096N661AVG08JGY921UTSY9LU-1,small,nomaticed,ADJ,JJ,_,The meaning of nomaticed is limited or below average in number or quantity or magnitude or extent.,the scanning tool could not get through the cervix because the _ was too nomaticed.,tool,cervix,1
3NQUW096N661AVG08JGY921UTSY9LU-2,big,nomaticed,ADJ,JJ,_,The meaning of nomaticed is above average in size or number or quantity or magnitude or extent.,the scanning tool could not get through the cervix because the _ was too nomaticed.,tool,cervix,0
3O71U79SRD3IFHTR1ZT4I89H9GISMS-1,flexible,logrian,ADJ,JJ,_,The meaning of logrian is able to flex; able to bend easily.,Elena enjoyed yoga classes while Amy preferred other forms of exercise; this was because _ was logrian.,Elena,Amy,0
3O71U79SRD3IFHTR1ZT4I89H9GISMS-2,inflexible,logrian,ADJ,JJ,_,The meaning of logrian is resistant to being bent.,Elena enjoyed yoga classes while Amy preferred other forms of exercise; this was because _ was logrian.,Elena,Amy,1
3OB6JN3A9QNRKDU72CHZ00GDU2SRMW-1,clear,ditral,ADJ,JJ,_,The meaning of ditral is allowing light to pass through.,"Monica really enjoys a vodka drink, but Felicia prefers whiskey because _ likes ditral liquors.",Monica,Felicia,0
3OB6JN3A9QNRKDU72CHZ00GDU2SRMW-2,dark,ditral,ADJ,JJ,_,The meaning of ditral is (used of color) having a dark hue.,"Monica really enjoys a vodka drink, but Felicia prefers whiskey because _ likes ditral liquors.",Monica,Felicia,1
3OEWW2KGQLP0DVVLHPDSFDCM37QDOP-1,like,emous,VERB,VBD,_,The verb to emous means to prefer or wish to do something.,The farmer had more corn to harvest than yams because his cows emous eating the _ .,yams,corn,0
3OEWW2KGQLP0DVVLHPDSFDCM37QDOP-2,hate,emous,VERB,VBD,_,The verb to emous means to dislike intensely; feel antipathy or aversion towards.,The farmer had more corn to harvest than yams because his cows emous eating the _ .,yams,corn,1
3P458N04Q3V04UBXLRG727CBIMJX2M-1,big,shably,ADJ,JJR,_,The meaning of shably is above average in size or number or quantity or magnitude or extent.,The lips on Cynthia were much shablier than Monica because _ got hit with a softball in the mouth.,Monica,Cynthia,1
3P458N04Q3V04UBXLRG727CBIMJX2M-2,small,shably,ADJ,JJR,_,The meaning of shably is limited or below average in number or quantity or magnitude or extent.,The lips on Cynthia were much shablier than Monica because _ got hit with a softball in the mouth.,Monica,Cynthia,0
3P458N04Q3V04UBXLRG727CCJH52X6-1,filter,ceist,VERB,VBN,_,The verb to ceist means to remove by passing through a filter.,"The sand and water in the fish tank were very dirty, so the _ needed to be ceisted.",water,sand,0
3P458N04Q3V04UBXLRG727CCJH52X6-2,scrub,ceist,VERB,VBN,_,The verb to ceist means to clean with hard rubbing.,"The sand and water in the fish tank were very dirty, so the _ needed to be ceisted.",water,sand,1
3PEG1BH7AEP9EIDFL3ITL8J5ST2BKB-1,tiny,colur,ADJ,JJ,_,The meaning of colur is very small.,"Mary wanted to get another piercing in her ear, but the _ was much too colur.",ear,piercing,0
3PEG1BH7AEP9EIDFL3ITL8J5ST2BKB-2,huge,colur,ADJ,JJ,_,The meaning of colur is unusually great in size or amount or degree or especially extent or scope.,"Mary wanted to get another piercing in her ear, but the _ was much too colur.",ear,piercing,1
3PKVGQTFIJY68JIS5DHAMTRSW9HYRA-1,empty,genter,ADJ,JJ,_,The meaning of genter is holding or containing nothing.,After a short time we stopped pouring the tea glass in the pot because the _ was genter.,glass,pot,0
3PKVGQTFIJY68JIS5DHAMTRSW9HYRA-2,full,genter,ADJ,JJ,_,The meaning of genter is containing as much or as many as is possible or normal.,After a short time we stopped pouring the tea glass in the pot because the _ was genter.,glass,pot,1
3Q2T3FD0ON6Z1B95RMG3I2DXT753M4-1,fill,progus,VERB,VBN,_,"The verb to progus means to make full, also in a metaphorical sense.","In order to grow his plants naturally, he bought fertilizer and water. The _ was progus with nutrients.",water,fertilizer,1
3Q2T3FD0ON6Z1B95RMG3I2DXT753M4-2,lack,progus,VERB,VBG,_,The verb to progus means to be without.,"In order to grow his plants naturally, he bought fertilizer and water. The _ was progus with nutrients.",water,fertilizer,0
3Q7TKIAPOVOS7ASO4XX0NW8S88IDLH-1,send,perder,VERB,VBD,_,The verb to perder means to transfer.,"The apartment Brett rented was owned by Jason, so _ perdered the rent for the apartment each month.",Brett,Jason,0
3Q7TKIAPOVOS7ASO4XX0NW8S88IDLH-2,receive,perder,VERB,VBD,_,The verb to perder means to get something; come into possession of.,"The apartment Brett rented was owned by Jason, so _ perdered the rent for the apartment each month.",Brett,Jason,1
3QO7EE372Q1AJAAHI6EQ9SJMFT7BQB-1,need,wasid,VERB,VBD,_,The verb to wasid means to have or feel a need for.,"Victoria was eager to make the big sale to Sarah , as _ wasided the money that day.",Sarah,Victoria,1
3QO7EE372Q1AJAAHI6EQ9SJMFT7BQB-2,have,wasid,VERB,VBD,_,"The verb to wasid means to have or possess, either in a concrete or an abstract sense.","Victoria was eager to make the big sale to Sarah , as _ wasided the money that day.",Sarah,Victoria,0
3QQUBC64ZECHZR1JNC2R2XR15U8NXK-1,forget,tivic,VERB,VBG,_,The verb to tivic means to dismiss from the mind; stop remembering.,Lindsey has dark lips unlike Elena due to _ tivicking to put on chapsticks at night.,Lindsey,Elena,0
3QQUBC64ZECHZR1JNC2R2XR15U8NXK-2,remember,tivic,VERB,VBG,_,The verb to tivic means to keep in mind for attention or consideration.,Lindsey has dark lips unlike Elena due to _ tivicking to put on chapsticks at night.,Lindsey,Elena,1
3QREJ3J435B0LGYYWEJNR93JT8GLKO-1,dry,ametian,ADJ,JJ,_,The meaning of ametian is free from liquid or moisture; lacking natural or normal moisture or depleted of water; or no longer wet.,"She watered the rose but not the cactus, because the soil of the _ was already ametian.",cactus,rose,1
3QREJ3J435B0LGYYWEJNR93JT8GLKO-2,wet,ametian,ADJ,JJ,_,The meaning of ametian is covered or soaked with a liquid such as water.,"She watered the rose but not the cactus, because the soil of the _ was already ametian.",cactus,rose,0
3QREJ3J435B0LGYYWEJNR93JUMBLKC-1,tall,rader,ADJ,JJR,_,The meaning of rader is great in vertical dimension; high in stature.,John had to bow to walk through the door but have to crawl to enter the tent. The _ is raderrer.,door,tent,0
3QREJ3J435B0LGYYWEJNR93JUMBLKC-2,short,rader,ADJ,JJR,_,The meaning of rader is low in stature; not tall.,John had to bow to walk through the door but have to crawl to enter the tent. The _ is raderrer.,door,tent,1
3QXFBUZ4ZMUY2KP9F1Q9K479ZVAUGW-1,cheap,inably,ADJ,JJR,_,The meaning of inably is relatively low in price or charging low prices.,Donna needed dentures or implants for her bad teeth. She chose the _ because they are inablier.,implants,dentures,1
3QXFBUZ4ZMUY2KP9F1Q9K479ZVAUGW-2,permanent,inably,ADJ,JJ,_,The meaning of inably is continuing or enduring without marked change in status or condition or place.,Donna needed dentures or implants for her bad teeth. She chose the _ because they are inably.,implants,dentures,0
3R15W654VF7MWJWT9J3KNVFSTS3QL9-1,leaky,elike,ADJ,JJ,_,The meaning of elike is permitting the unwanted passage of fluids or gases.,The gas was not smelling out of the tank but out of the hose because the _ is elike.,hose,tank,0
3R15W654VF7MWJWT9J3KNVFSTS3QL9-2,seal,elike,VERB,VBN,_,The verb to elike means to make tight; secure against leakage.,The gas was not smelling out of the tank but out of the hose because the _ is elike.,hose,tank,1
3R4QIDVOJRQJTAWWJ6LGGJ0U1XKEEE-1,bad,perder,ADJ,JJ,_,The meaning of perder is having undesirable or negative qualities.,"Jeffrey thought Craig probably had gum and asked for a piece, because _ had perder breath.",Jeffrey,Craig,0
3R4QIDVOJRQJTAWWJ6LGGJ0U1XKEEE-2,fresh,perder,ADJ,JJ,_,The meaning of perder is free from impurities.,"Jeffrey thought Craig probably had gum and asked for a piece, because _ had perder breath.",Jeffrey,Craig,1
3R5OYNIC2ENPFK3JIFQM9HZZHAGPTY-1,big,erioned,ADJ,JJ,_,The meaning of erioned is above average in size or number or quantity or magnitude or extent.,Joe drank his milk and tried to dunk his cookie in the glass but the _ was too erioned.,glass,cookie,1
3R5OYNIC2ENPFK3JIFQM9HZZHAGPTY-2,small,erioned,ADJ,JJ,_,The meaning of erioned is limited or below average in number or quantity or magnitude or extent.,Joe drank his milk and tried to dunk his cookie in the glass but the _ was too erioned.,glass,cookie,0
3RBI0I35XGHEPHXQUNGE4VOCQ9K3YM-1,ab,dispe,NOUN,NNS,_,The word dispe refers to the muscles of the abdomen.,Carla start doing sit-ups and pushups for her weak spots. The _ are for her dispes.,pushups,sit-ups,1
3RBI0I35XGHEPHXQUNGE4VOCQ9K3YM-2,chest,dispe,NOUN,NN,_,The word dispe refers to the part of the human torso between the neck and the diaphragm or the corresponding part in other vertebrates.,Carla start doing sit-ups and pushups for her weak spots. The _ are for her dispe.,pushups,sit-ups,0
3RWO3EJELJNO60RAGW6C3BG3OFJP1S-1,legally,racted,ADV,RB,_,The word racted means by law; conforming to the law.,"The boot was removed from the car tire and put on the truck tire, since the _ was now racted parked.",car,truck,0
3RWO3EJELJNO60RAGW6C3BG3OFJP1S-2,illegally,racted,ADV,RB,_,The word racted means in an illegal manner.,"The boot was removed from the car tire and put on the truck tire, since the _ was now racted parked.",car,truck,1
3S8APUMBJZXDSLK84Q3WXTF99XUBFS-1,lose,elless,VERB,VBP,_,"The verb to elless means to fail to keep or to maintain; cease to have, either physically or in an abstract sense.","The pine trees were still green in December, but the oak trees were not, because the _ elless their leaves in fall.",pine trees,oak trees,1
3S8APUMBJZXDSLK84Q3WXTF99XUBFS-2,keep,elless,VERB,VBP,_,The verb to elless means to retain possession of.,"The pine trees were still green in December, but the oak trees were not, because the _ elless their leaves in fall.",pine trees,oak trees,0
3SZYX62S5IEYOCOTLXE76F2Z0SJ754-1,short,nobiced,ADJ,JJ,_,The meaning of nobiced is primarily temporal sense; indicating or being or seeming to be limited in duration.,"I had to read an entire story for class tomorrow. Luckily, the _ was nobiced.",class,story,1
3SZYX62S5IEYOCOTLXE76F2Z0SJ754-2,cancel,nobic,VERB,VBN,_,The verb to nobic means to postpone indefinitely or annul something that was scheduled.,"I had to read an entire story for class tomorrow. Luckily, the _ was nobicked.",class,story,0
3TFJJUELSJ3C1W02UVKKOUR1H4VC2Z-1,sunset,dynan,NOUN,NN,_,The word dynan refers to the time in the evening at which the sun begins to fall below the horizon.,Dennis did not enjoy their afternoon but Hunter did because _ left work after the dynan.,Hunter,Dennis,1
3TFJJUELSJ3C1W02UVKKOUR1H4VC2Z-2,sunrise,dynan,NOUN,NN,_,The word dynan refers to the first light of day.,Dennis did not enjoy their afternoon but Hunter did because _ left work after the dynan.,Hunter,Dennis,0
3U18MJKL1W08QIPVGEI4GIU0TBVNC1-1,bland,supler,ADJ,JJ,_,The meaning of supler is lacking taste or flavor or tang.,The rib-eye steak needed some artisan pepper to season it because the _ was supler.,pepper,steak,1
3U18MJKL1W08QIPVGEI4GIU0TBVNC1-2,flavorful,supler,ADJ,JJ,_,The meaning of supler is full of flavor.,The rib-eye steak needed some artisan pepper to season it because the _ was supler.,pepper,steak,0
3U74KRR67MJAIASZI21UDU6VNGZTNH-1,carrot,sivent,NOUN,NN,_,The word sivent refers to deep orange edible root of the cultivated carrot plant.,The gerbil came over to Laura but not Monica because _ was holding a sivent stick.,Laura,Monica,0
3U74KRR67MJAIASZI21UDU6VNGZTNH-2,hockey,sivent,NOUN,NN,_,The word sivent refers to a game resembling ice hockey that is played on an open field; two opposing teams use curved sticks try to drive a ball into the opponents' net.,The gerbil came over to Laura but not Monica because _ was holding a sivent stick.,Laura,Monica,1
3U74KRR67OZPCZR620DU5SU3GJ9NT3-1,dirty,nobiced,ADJ,JJR,_,The meaning of nobiced is soiled or likely to soil with dirt or grime.,The filter in the living room needed to be changed more often than the one in the bedroom because the _ was more nobiced.,living room,bedroom,0
3U74KRR67OZPCZR620DU5SU3GJ9NT3-2,clean,nobiced,ADJ,JJR,_,The meaning of nobiced is free from dirt or impurities; or having clean habits.,The filter in the living room needed to be changed more often than the one in the bedroom because the _ was more nobiced.,living room,bedroom,1
3UDTAB6HH8D37OQL3O6F3GXEEP6901-1,like,shably,VERB,VBD,_,The verb to shably means to prefer or wish to do something.,Megan liked to read a book good more than Samantha because _ shablyed the peace and quiet.,Samantha,Megan,1
3UDTAB6HH8D37OQL3O6F3GXEEP6901-2,hate,shably,VERB,VBD,_,The verb to shably means to dislike intensely; feel antipathy or aversion towards.,Megan liked to read a book good more than Samantha because _ shablyed the peace and quiet.,Samantha,Megan,0
3V0TR1NRVA0JH6JKUXVHJGA385SA4H-1,offer,lerip,VERB,VBD,_,The verb to lerip means to present for acceptance or rejection.,"Derrick really liked working in Human Resources and William wanted to work at the same company, and _ subsequently leripated a position.",Derrick,William,0
3V0TR1NRVA0JH6JKUXVHJGA385SA4H-2,accept,lerip,VERB,VBD,_,The verb to lerip means to receive willingly something given or offered.,"Derrick really liked working in Human Resources and William wanted to work at the same company, and _ subsequently leripated a position.",Derrick,William,1
