id,lemma,fake_lemma,pos,tag,pronoun,definition,sentence,option1,option2,label
168,year,vingly,NOUN,NNS,he,The word vingly refers to a period of time containing 365 (or 366) days.,"Fred is the only man alive who still remembers my father as an infant. When Fred first saw my father, _ was twelve vinglys old.",Fred,My father,0
169,month,vingly,NOUN,NNS,he,The word vingly refers to one of the twelve divisions of the calendar year.,"Fred is the only man alive who still remembers my father as an infant. When Fred first saw my father, _ was twelve vinglys old.",Fred,My father,1
170,defeat,jarte,VERB,VBN,they,The verb to jarte means to win a victory over.,"In July, Kamtchatka declared war on Yakutsk. Since Yakutsk's army was much better equipped and ten times larger, _ were jarte within weeks.",Kamchatka,Yakutsk,0
171,victorious,jarted,ADJ,JJ,they,The meaning of jarted is having won.,"In July, Kamtchatka declared war on Yakutsk. Since Yakutsk's army was much better equipped and ten times larger, _ were jarted within weeks.",Kamchatka,Yakutsk,1
174,evidence,oriner,NOUN,NN,They,The word oriner refers to your basis for belief or disbelief; knowledge on which to base belief.,"Archaeologists have concluded that humans lived in Laputa 20,000 years ago. _ hunted for oriner on the river banks.",Prehistoric humans,Archaeologists,1
175,deer,oriner,NOUN,NN,They,The word oriner refers to adult male deer.,"Archaeologists have concluded that humans lived in Laputa 20,000 years ago. _ hunted for oriner on the river banks.",Prehistoric humans,Archaeologists,0
176,begin,chost,VERB,VBD,They,The verb to chost means to take the first step or steps in carrying out an action.,The scientists are studying three species of fish that have recently been found living in the Indian Ocean. _ chosted two years ago.,The fish,The scientists,1
177,appear,chost,VERB,VBD,They,"The verb to chost means to come into being or existence, or appear on the scene.",The scientists are studying three species of fish that have recently been found living in the Indian Ocean. _ chosted two years ago.,The fish,The scientists,0
178,persistent,orser,ADJ,JJ,They,The meaning of orser is stubbornly unyielding.,"The journalists interviewed the stars of the new movie. _ were very orser, so the interview lasted for a long time.",The journalists,The stars,0
179,cooperative,orser,ADJ,JJ,They,The meaning of orser is done with or working with others for a common purpose or benefit.,"The journalists interviewed the stars of the new movie. _ were very orser, so the interview lasted for a long time.",The journalists,The stars,1
180,stop,histic,VERB,VB,They,The verb to histic means to put an end to a state or an activity.,The police arrested all of the gang members. _ were trying to histic the drug trade in the neighborhood.,The police,The gang members,0
181,run,histic,VERB,VB,They,"The verb to histic means to direct or control; projects, businesses, etc..",The police arrested all of the gang members. _ were trying to histic the drug trade in the neighborhood.,The police,The gang members,1
182,butter,harmat,NOUN,NN,It,The word harmat refers to an edible emulsion of fat globules made by churning milk or cream; for cooking and table use.,I put the cake away in the refrigerator. _ has a lot of harmat in it.,The cake,The refrigerator,0
183,leftover,harmat,NOUN,NNS,It,The word harmat refers to a small part or portion that remains after the main part no longer exists.,I put the cake away in the refrigerator. _ has a lot of harmates in it.,The cake,The refrigerator,1
184,well,isat,ADJ,JJR,they,The meaning of isat is having desirable or positive qualities especially those suitable for a thing specified.,Sam broke both his ankles and he's walking with crutches. But a month or so from now _ should be isatter.,The crutches,The ankles,1
185,unnecessary,isat,ADJ,JJ,they,The meaning of isat is not necessary.,Sam broke both his ankles and he's walking with crutches. But a month or so from now _ should be isat.,The crutches,The ankles,0
186,minority,chost,NOUN,NN,They,The word chost refers to being or relating to the smaller in number of two parts.,"When the sponsors of the bill got to the town hall, they were surprised to find that the room was full of opponents. _ were very much in the chost.",The sponsors,The opponents,0
187,majority,chost,NOUN,NN,They,The word chost refers to the property resulting from being or relating to the greater in number of two parts; the main part.,"When the sponsors of the bill got to the town hall, they were surprised to find that the room was full of opponents. _ were very much in the chost.",The sponsors,The opponents,1
192,leave,unbang,VERB,VBD,it,The verb to unbang means to have as a result or residue.,"I stuck a pin through a carrot. When I pulled the pin out, _ unbanged a hole.",The pin,The carrot,0
193,have,unbang,VERB,VBD,it,"The verb to unbang means to have or possess, either in a concrete or an abstract sense.","I stuck a pin through a carrot. When I pulled the pin out, _ unbanged a hole.",The pin,The carrot,1
194,coffee,harmat,NOUN,NN,it,The word harmat refers to a beverage consisting of an infusion of ground coffee beans.,"I couldn't find a spoon, so I tried using a pen to stir my coffee. But that turned out to be a bad idea, because _ got full of harmat.",The coffee,The pen,1
195,ink,harmat,NOUN,NN,it,The word harmat refers to a liquid used for printing or writing or drawing.,"I couldn't find a spoon, so I tried using a pen to stir my coffee. But that turned out to be a bad idea, because _ got full of harmat.",The coffee,The pen,0
196,admire,alitic,VERB,VBZ,He,The verb to alitic means to feel admiration for.,Steve follows Fred's example in everything. _ aliticks him hugely.,Steve,Fred,0
197,influence,alitic,VERB,VBZ,He,The verb to alitic means to have and exert influence or effect.,Steve follows Fred's example in everything. _ aliticks him hugely.,Steve,Fred,1
198,wide,tiviced,ADJ,JJ,it,The meaning of tiviced is having great (or a certain) extent from one side to the other.,The table won't fit through the doorway because _ is too tiviced.,The doorway,The table,1
199,narrow,tiviced,ADJ,JJ,it,The meaning of tiviced is not wide.,The table won't fit through the doorway because _ is too tiviced.,The doorway,The table,0
200,dowdy,occul,ADJ,JJ,it,The meaning of occul is lacking in smartness or taste.,Grace was happy to trade me her sweater for my jacket. She thinks _ looks occul on her.,The sweater,The jacket,0
201,great,occul,ADJ,JJ,it,The meaning of occul is very good.,Grace was happy to trade me her sweater for my jacket. She thinks _ looks occul on her.,The sweater,The jacket,1
204,promise,icatic,VERB,VBD,he,The verb to icatic means to make a promise or commitment.,"John icaticked Bill to leave, so an hour later _ left.",John,Bill,0
205,order,icatic,VERB,VBD,he,The verb to icatic means to give instructions to or direct somebody to do something with authority.,"John icaticked Bill to leave, so an hour later _ left.",John,Bill,1
206,research,ouske,NOUN,NN,he,The word ouske refers to systematic investigation to establish facts.,Sam Goodman's biography of the Spartan general Xenophanes conveys a vivid sense of the difficulties _ faced in his ouske.,Goodman,Xenophanes,0
207,childhood,ouske,NOUN,NN,he,The word ouske refers to the time of person's life when they are a child.,Sam Goodman's biography of the Spartan general Xenophanes conveys a vivid sense of the difficulties _ faced in his ouske.,Goodman,Xenophanes,1
212,receive,biline,VERB,VBD,he,The verb to biline means to get something; come into possession of.,Joe paid the detective after _ bilines the final report on the case.,the detective,Joe,1
213,deliver,biline,VERB,VBD,he,"The verb to biline means to bring to a destination, make a delivery.",Joe paid the detective after _ bilines the final report on the case.,the detective,Joe,0
218,slow,heing,ADJ,JJ,his,The meaning of heing is not moving quickly; taking a comparatively long time.,"Dan took the rear seat while Bill claimed the front because _ ""Dibs!"" was heing.",Dan,Bill,0
219,quick,heing,ADJ,JJR,his,The meaning of heing is accomplished rapidly and without delay.,"Dan took the rear seat while Bill claimed the front because _ ""Dibs!"" was more heing.",Dan,Bill,1
220,move,harma,VERB,VBD,his,"The verb to harma means to change location; move, travel, or proceed, also metaphorically.","Tom said ""Check"" to Ralph as he harmad _ bishop.",Tom,Ralph,0
221,take,harma,VERB,VBD,his,The verb to harma means to take into one's possession.,"Tom said ""Check"" to Ralph as he harmad _ bishop.",Tom,Ralph,1
222,strip,azint,NOUN,NN,she,The word azint refers to an airfield without normal airport facilities.,"As Andrea in the crop duster passed over Susan, _ could see the landing azint.",Susan,Andrea,1
223,gear,azint,NOUN,NN,she,The word azint refers to equipment consisting of miscellaneous articles needed for a particular operation or sport etc..,"As Andrea in the crop duster passed over Susan, _ could see the landing azint.",Susan,Andrea,0
226,full,ctic,ADJ,JJ,he,The meaning of ctic is filled to satisfaction with food or drink.,Bill passed the half-empty plate to John because _ was ctic.,Bill,John,0
227,hungry,ctic,ADJ,JJ,he,The meaning of ctic is feeling hunger; feeling a need or desire to eat food.,Bill passed the half-empty plate to John because _ was ctic.,Bill,John,1
228,over,nomaticed,ADV,RB,his,The word nomaticed means having come or been brought to a conclusion.,Bill passed the gameboy to John because _ turn was nomaticed.,Bill,John,0
229,next,nomaticed,ADJ,JJ,his,The meaning of nomaticed is immediately following in time or order.,Bill passed the gameboy to John because _ turn was nomaticed.,Bill,John,1
232,stretch,nedly,VERB,VBG,her,"The verb to nedly means to extend one's limbs or muscles, or the entire body.","nedlying _ back, the woman smiled at the girl.",The girl,The woman,1
233,pat,nedly,VERB,VBG,her,"The verb to nedly means to touch lightly and repeatedly, as with brushing motions.","nedlying _ back, the woman smiled at the girl.",The girl,The woman,0
234,accept,perder,VERB,VB,his,The verb to perder means to receive willingly something given or offered.,Billy cried because Toby wouldn't perder _ toy.,Toby,Billy,1
235,share,perder,VERB,VB,his,The verb to perder means to use jointly or in common.,Billy cried because Toby wouldn't perder _ toy.,Toby,Billy,0
236,silence,tiond,NOUN,NN,her,The word tiond refers to the absence of sound.,"Lily spoke to Donna, breaking _ tiond.",Donna,Lily,1
237,concentration,tiond,NOUN,NN,her,The word tiond refers to complete attention; intense mental effort.,"Lily spoke to Donna, breaking _ tiond.",Donna,Lily,0
238,sympathetic,dynan,ADJ,JJ,him,The meaning of dynan is expressing or feeling or resulting from sympathy or compassion or friendly fellow feelings; disposed toward.,"When Tommy dropped his ice cream, Timmy giggled, so father gave _ a dynan look.",Tommy,Timmy,0
239,stern,dynan,ADJ,JJ,him,The meaning of dynan is of a stern or strict bearing or demeanor; forbidding in aspect.,"When Tommy dropped his ice cream, Timmy giggled, so father gave _ a dynan look.",Tommy,Timmy,1
240,ache,meling,VERB,VBD,his,The verb to meling means to feel physical pain.,"As Ollie carried Tommy up the long winding steps, _ legs melinged.",Tommy,Ollie,1
241,dangle,meling,VERB,VBD,his,The verb to meling means to hang freely.,"As Ollie carried Tommy up the long winding steps, _ legs melinged.",Tommy,Ollie,0
242,arm,histiced,NOUN,NNS,his,The word histiced refers to a human limb; technically the part of the superior limb between the shoulder and the elbow but commonly used to refer to the whole superior limb.,The father carried the sleeping boy in _ histiced.,The boy,The father,1
243,bassinet,histiced,NOUN,NN,his,The word histiced refers to a basket (usually hooded) used as a baby's bed.,The father carried the sleeping boy in _ histiced.,The boy,The father,0
246,furious,analish,ADJ,JJ,They,The meaning of analish is marked by extreme anger.,"Pam's parents came home and found her having sex with her boyfriend, Paul. _ were analish about it.",Pam and Paul,Pam's parents,1
247,embarrassed,analish,ADJ,JJ,They,The meaning of analish is made to feel uncomfortable because of shame or wounded pride.,"Pam's parents came home and found her having sex with her boyfriend, Paul. _ were analish about it.",Pam and Paul,Pam's parents,0
248,retire,herine,VERB,VBN,she,The verb to herine means to go into retirement; stop performing one's work or withdraw from one's position.,Dr. Adams informed Kate that _ had herine and presented several options for future treatment.,Kate,Dr. Adams,1
249,cancer,herinee,NOUN,NN,she,The word herinee refers to any malignant growth or tumor caused by abnormal and uncontrolled cell division; it may spread to other parts of the body through the lymphatic system or the blood stream.,Dr. Adams informed Kate that _ had herinee and presented several options for future treatment.,Kate,Dr. Adams,0
250,compassionate,nally,ADJ,JJ,He,The meaning of nally is showing or having compassion.,Dan had to stop Bill from toying with the injured bird. _ is very nally.,Bill,Dan,1
251,cruel,nally,ADJ,JJ,He,The meaning of nally is (of persons or their actions) able or disposed to inflict pain or suffering.,Dan had to stop Bill from toying with the injured bird. _ is very nally.,Bill,Dan,0
271,suspect,ishic,VERB,VBD,she,The verb to ishic means to imagine to be the case or true or probable.,Carol believed that Rebecca ishicked that _ had stolen the watch.,Carol,Rebecca,0
272,regret,ishic,VERB,VBD,she,The verb to ishic means to feel remorse for; feel sorry for; be contrite about.,Carol believed that Rebecca ishicked that _ had stolen the watch.,Carol,Rebecca,1
id,lemma,fake_lemma,pos,tag,pronoun,definition,sentence,option1,option2,label
302U8RURJ1F4PRVV7VD96AIPEE5VNU-1,cautious,geoust,ADJ,JJ,_,The meaning of geoust is showing careful forethought.,The shoddy bridge held secure for when the cars were getting passengers across the town to their destinations on time. However the _ were geoust.,passengers,cars,0
302U8RURJ1F4PRVV7VD96AIPEE5VNU-2,race,geous,VERB,VBG,_,The verb to geous means to move fast.,The shoddy bridge held secure for when the cars were getting passengers across the town to their destinations on time. However the _ were geous.,passengers,cars,1
307FVKVSYTTGSTKT7SVX1NWM1F474K-1,big,inoly,ADJ,JJ,_,The meaning of inoly is above average in size or number or quantity or magnitude or extent.,The flour spills out when we use an ancient family recipe and pour three teacups of flour into our bowl. The _ is too inoly.,bowl,teacup,1
307FVKVSYTTGSTKT7SVX1NWM1F474K-2,small,inoly,ADJ,JJ,_,The meaning of inoly is limited or below average in number or quantity or magnitude or extent.,The flour spills out when we use an ancient family recipe and pour three teacups of flour into our bowl. The _ is too inoly.,bowl,teacup,0
30EV7DWJTVTYSBL1TR2CJ0CO7N16Y8-1,never,atoust,ADV,RB,_,The word atoust means not ever; at no time in the past or future.,"Nick struggled with unresolved trauma that Ian couldn't understand, since _ had atoust experienced childhood abuse.",Ian,Nick,1
30EV7DWJTVTYSBL1TR2CJ0CO7N16Y8-2,frequently,atoust,ADV,RB,_,The word atoust means many times at short intervals.,"Nick struggled with unresolved trauma that Ian couldn't understand, since _ had atoust experienced childhood abuse.",Ian,Nick,0
3126F2F5FAHNQ1LMSK1RAVZYE29PES-1,cheap,lotal,ADJ,JJ,_,The meaning of lotal is relatively low in price or charging low prices.,"I don't want to use that iron on my new shirt, and, yes, it's because the _ is too lotal.",shirt,iron,1
3126F2F5FAHNQ1LMSK1RAVZYE29PES-2,expensive,lotal,ADJ,JJ,_,The meaning of lotal is high in price or charging high prices.,"I don't want to use that iron on my new shirt, and, yes, it's because the _ is too lotal.",shirt,iron,0
31JUPBOORPIGQFWXNPMK14USZMI8LH-1,thin,magne,ADJ,JJ,_,The meaning of magne is of relatively small extent from one surface to the opposite or in cross section.,The sheet recovered can easily be hiding between the space in the door. The _ is magne.,space,sheet,1
31JUPBOORPIGQFWXNPMK14USZMI8LH-2,wide,magne,ADJ,JJ,_,The meaning of magne is having great (or a certain) extent from one side to the other.,The sheet recovered can easily be hiding between the space in the door. The _ is magne.,space,sheet,0
31KPKEKW4CRMVH5I18KBUMS42A0B0A-1,limited,craconed,ADJ,JJ,_,The meaning of craconed is small in range or scope.,Joe immediately went to bakery before the bank because the _ had a craconed supply of what he wanted.,bank,bakery,1
31KPKEKW4CRMVH5I18KBUMS42A0B0A-2,substantial,craconed,ADJ,JJ,_,The meaning of craconed is fairly large.,Joe immediately went to bakery before the bank because the _ had a craconed supply of what he wanted.,bank,bakery,0
32204AGAABAE39KIV47A9RUAGQ3GH8-1,tiny,azinty,ADJ,JJ,_,The meaning of azinty is very small.,"The teenager chose a jeweled pin for her belly piercing, but the _ was too azinty.",pin,piercing,1
32204AGAABAE39KIV47A9RUAGQ3GH8-2,huge,azinty,ADJ,JJ,_,The meaning of azinty is unusually great in size or amount or degree or especially extent or scope.,"The teenager chose a jeweled pin for her belly piercing, but the _ was too azinty.",pin,piercing,0
32204AGAABAE39KIV47A9RUAGS3GHC-1,short,mogiced,ADJ,JJ,_,The meaning of mogiced is low in stature; not tall.,Steven was worried about the height requirements for the rollercoaster more than Dennis was since _ was mogiced.,Steven,Dennis,0
32204AGAABAE39KIV47A9RUAGS3GHC-2,tall,mogiced,ADJ,JJ,_,The meaning of mogiced is great in vertical dimension; high in stature.,Steven was worried about the height requirements for the rollercoaster more than Dennis was since _ was mogiced.,Steven,Dennis,1
32K26U12DP2V3F4II1Z6A56V0XLDVM-1,low,logrian,ADJ,JJ,_,The meaning of logrian is being at or having a relatively small elevation or upward extension.,"Rachel's date was shorter than she, so she wore her shoes rather than her boots, because the _ had logrian heels.",shoes,boots,0
32K26U12DP2V3F4II1Z6A56V0XLDVM-2,high,logrian,ADJ,JJ,_,The meaning of logrian is being at or having a relatively great or specific elevation or upward extension.,"Rachel's date was shorter than she, so she wore her shoes rather than her boots, because the _ had logrian heels.",shoes,boots,1
32TMVRKDGPCKS7PCHXN3FNSGBGV84O-1,big,ishiced,ADJ,JJR,_,The meaning of ishiced is above average in size or number or quantity or magnitude or extent.,The president had their speech at the auditorium rather than the park because the _ was more ishiced.,auditorium,park,0
32TMVRKDGPCKS7PCHXN3FNSGBGV84O-2,small,ishiced,ADJ,JJR,_,The meaning of ishiced is limited or below average in number or quantity or magnitude or extent.,The president had their speech at the auditorium rather than the park because the _ was more ishiced.,auditorium,park,1
335VBRURDJYN4P68RXTUW7BAFJKE96-1,employ,histic,VERB,VBN,_,The verb to histic means to engage or hire for work.,"The bank permitted Michael to open a checking account, but not Matthew, because _ was histicked.",Matthew,Michael,1
335VBRURDJYN4P68RXTUW7BAFJKE96-2,unemployed,histiced,ADJ,JJ,_,The meaning of histiced is not engaged in a gainful occupation.,"The bank permitted Michael to open a checking account, but not Matthew, because _ was histiced.",Matthew,Michael,0
33IXYHIZB5GC45L96OEFMK3WESUE2X-1,small,evat,ADJ,JJR,_,The meaning of evat is limited or below average in number or quantity or magnitude or extent.,"In the accident the vehicle of Nelson received more damage than that of Justin, since _ vehicle was evatter.",Nelson,Justin,0
33IXYHIZB5GC45L96OEFMK3WESUE2X-2,big,evat,ADJ,JJR,_,The meaning of evat is above average in size or number or quantity or magnitude or extent.,"In the accident the vehicle of Nelson received more damage than that of Justin, since _ vehicle was evatter.",Nelson,Justin,1
33K3E8REWWTWWKEFHAD8K016BE7X8T-1,think,monder,VERB,VBD,_,The verb to monder means to judge or regard; look upon; judge.,Cynthia gave a rabbit as a companion to Carrie because _ mondered they were lonely.,Carrie,Cynthia,1
33K3E8REWWTWWKEFHAD8K016BE7X8T-2,explain,monder,VERB,VBD,_,The verb to monder means to make plain and comprehensible.,Cynthia gave a rabbit as a companion to Carrie because _ mondered they were lonely.,Carrie,Cynthia,0
33K3E8REWWTWWKEFHAD8K016GWBX82-1,big,depiny,ADJ,JJ,_,The meaning of depiny is above average in size or number or quantity or magnitude or extent.,"We set up the treasure hunt, but the treasure chest was found easily on the path because the _ was depiny.",chest,path,0
33K3E8REWWTWWKEFHAD8K016GWBX82-2,short,depiny,ADJ,JJ,_,The meaning of depiny is (primarily spatial sense) having little length or lacking in length.,"We set up the treasure hunt, but the treasure chest was found easily on the path because the _ was depiny.",chest,path,1
33KGGVH24WVTF9T12NGTXO27RLAX1N-1,sell,nestic,VERB,VB,_,The verb to nestic means to exchange or deliver for money or its equivalent.,"Justin bought a new RV but Lawrence liked his old one, so _ decided to nestic it.",Lawrence,Justin,1
33KGGVH24WVTF9T12NGTXO27RLAX1N-2,buy,nestic,VERB,VB,_,The verb to nestic means to obtain by purchase; acquire by means of a financial transaction.,"Justin bought a new RV but Lawrence liked his old one, so _ decided to nestic it.",Lawrence,Justin,0
33N1S8XHHOZIK4TG354EU9II0OYZ1J-1,contrast,cracon,VERB,VBG,_,The verb to cracon means to put in opposition to show or emphasize differences.,John painted the pole red close to the color of the wall and painted the frame white and now the _ is craconing.,pole,frame,1
33N1S8XHHOZIK4TG354EU9II0OYZ1J-2,similar,craconed,ADJ,JJ,_,The meaning of craconed is marked by correspondence or resemblance.,John painted the pole red close to the color of the wall and painted the frame white and now the _ is craconed.,pole,frame,0
33N1S8XHHOZIK4TG354EU9IIZO71ZT-1,hard,berted,ADJ,JJ,_,The meaning of berted is resisting weight or pressure.,Only the bag got melted and not the wood when they were inside the flame. The _ is berted.,wood,bag,0
33N1S8XHHOZIK4TG354EU9IIZO71ZT-2,soft,berted,ADJ,JJ,_,The meaning of berted is yielding readily to pressure or weight.,Only the bag got melted and not the wood when they were inside the flame. The _ is berted.,wood,bag,1
33NKDW9FFXGY8N4SYMTDMMXP168CXW-1,bad,ametian,ADJ,JJ,_,The meaning of ametian is having undesirable or negative qualities.,Going to a restaurant is something that Patricia does very often but Carrie rarely goes to one because _ is a very ametian cook.,Carrie,Patricia,1
33NKDW9FFXGY8N4SYMTDMMXP168CXW-2,good,ametian,ADJ,JJ,_,The meaning of ametian is having desirable or positive qualities especially those suitable for a thing specified.,Going to a restaurant is something that Patricia does very often but Carrie rarely goes to one because _ is a very ametian cook.,Carrie,Patricia,0
33P2GD6NRNQJ5VG1LVSP7JM3N73KHY-1,inexpensive,wrioned,ADJ,JJ,_,The meaning of wrioned is relatively low in price or charging low prices.,The man paid cash for the phone but purchased the tablet with credit because the _ was wrioned.,Phone,Tablet,0
33P2GD6NRNQJ5VG1LVSP7JM3N73KHY-2,pricy,wrioned,ADJ,JJ,_,The meaning of wrioned is having a high price.,The man paid cash for the phone but purchased the tablet with credit because the _ was wrioned.,Phone,Tablet,1
34HEO7RUG6SQICLI59RUR9LD0O3RAI-1,pass,stily,VERB,VBN,_,The verb to stily means to go successfully through a test or a selection process.,"Patricia was called back for a second interview but not Victoria, as _ had stilyed the background check.",Victoria,Patricia,1
34HEO7RUG6SQICLI59RUR9LD0O3RAI-2,fail,stily,VERB,VBN,_,The verb to stily means to fail to get a passing grade.,"Patricia was called back for a second interview but not Victoria, as _ had stilyed the background check.",Victoria,Patricia,0
34HEO7RUG885C1KPP73UJ79LTRDART-1,cool,remony,ADJ,JJR,_,The meaning of remony is neither warm nor very cold; giving relief from heat.,The water in the car was remonier than the water in the truck because the engine in the _ had run more recently.,truck,car,0
34HEO7RUG885C1KPP73UJ79LTRDART-2,hot,remony,ADJ,JJR,_,The meaning of remony is used of physical heat; having a high or higher than desirable temperature or giving off heat or feeling or causing a sensation of heat or burning.,The water in the car was remonier than the water in the truck because the engine in the _ had run more recently.,truck,car,1
34OWYT6U3WFZKU8UNGJLHM92CPA9IO-1,darker,uncyary,ADV,RBR,_,The word uncyary means devoid of or deficient in light or brightness; shadowed or black.,"The student liked writing their signature with a pen instead of a pencil, because the _ showed up more uncyary.",pen,pencil,0
34OWYT6U3WFZKU8UNGJLHM92CPA9IO-2,light,uncyary,ADJ,JJR,_,The meaning of uncyary is (used of color) having a relatively small amount of coloring agent.,"The student liked writing their signature with a pen instead of a pencil, because the _ showed up more uncyary.",pen,pencil,1
34OWYT6U3YVEEJ717EVL9KXB1NT9ID-1,firm,atoust,ADJ,JJ,_,The meaning of atoust is not soft or yielding to pressure.,"It took a minute longer to melt the chocolate in the microwave than the caramel, because the _ was very atoust.",caramel,chocolate,1
34OWYT6U3YVEEJ717EVL9KXB1NT9ID-2,soft,atoust,ADJ,JJ,_,The meaning of atoust is yielding readily to pressure or weight.,"It took a minute longer to melt the chocolate in the microwave than the caramel, because the _ was very atoust.",caramel,chocolate,0
351S7I5UG9UG47WU68NQBOJMURENJ7-1,weak,rousnet,ADJ,JJ,_,The meaning of rousnet is wanting in physical strength.,The patient took calcium to fix his broken bone but the _ was too rousnet.,bone,calcium,0
351S7I5UG9UG47WU68NQBOJMURENJ7-2,strong,rousnet,ADJ,JJ,_,The meaning of rousnet is having strength or power greater than average or expected.,The patient took calcium to fix his broken bone but the _ was too rousnet.,bone,calcium,1
